{
  "$schema": "http://json-schema.org/draft-07/schema#",
  "$comment": "GENERATED by gui/schema-gen/derive_nf_config_schemas.py from config/aanf.json + its source (ADR-0425). Do not edit; regenerate.",
  "title": "aanf",
  "type": "object",
  "additionalProperties": false,
  "properties": {
    "port": {
      "type": "integer",
      "x-env-override": "AANF_PORT",
      "x-cpp-type": "unsigned short"
    },
    "sbi_bind_address": {
      "type": "string",
      "x-cpp-type": "std::string"
    },
    "advertised_ipv4": {
      "type": "string",
      "x-env-override": "AANF_ADVERTISED_IPV4",
      "x-cpp-type": "std::string"
    },
    "metrics_bind_address": {
      "type": "string",
      "x-env-override": "AANF_METRICS_BIND_ADDRESS",
      "x-cpp-type": "std::string"
    },
    "nrf_base_url": {
      "type": "string",
      "x-env-override": "AANF_NRF_BASE_URL",
      "x-cpp-type": "std::string"
    },
    "redis_url": {
      "type": "string",
      "x-env-override": "AANF_REDIS_URL",
      "x-cpp-type": "std::string"
    },
    "kaf_lifetime_seconds": {
      "type": "integer",
      "x-env-override": "AANF_KAF_LIFETIME_SECONDS",
      "x-cpp-type": "int"
    },
    "supi_to_af_without_token": {
      "type": "boolean",
      "x-sensitivity": "credential"
    },
    "allowed_af_fqdns": {
      "type": "array"
    },
    "udm_base_url": {
      "type": "string"
    },
    "gpsi_af_fqdns": {
      "type": "array"
    },
    "self_base_url": {
      "type": "string"
    },
    "deny_roaming_ues": {
      "type": "boolean"
    },
    "roaming_check_on_udm_failure": {
      "type": "string"
    },
    "oauth2_required": {
      "type": "boolean",
      "x-env-override": "AANF_OAUTH2_REQUIRED",
      "x-cpp-type": "bool"
    }
  },
  "required": [
    "advertised_ipv4",
    "kaf_lifetime_seconds",
    "metrics_bind_address",
    "nrf_base_url",
    "port",
    "redis_url",
    "sbi_bind_address"
  ],
  "x-config-file": "config/aanf.json",
  "x-source": [
    "nfs/aanf"
  ],
  "x-apply": "restart",
  "x-review": [
    "allowed_af_fqdns: empty array, item type unknown",
    "gpsi_af_fqdns: empty array, item type unknown"
  ]
}
